{
  "id": "pln_01J8R2D2J6N9TZ0R7Y8E1BCDFG",
  "command_id": "cmd_01J8R2A9F3K6QW7N4V5B8XYZCD",
  "goal": "Issue 412 becomes a pull request that passes CI.",
  "autonomy_level": 3,
  "due": "2026-09-16T04:00:00Z",
  "steps": [
    {
      "id": "read-issue",
      "method": "rule",
      "reason": "fetch by identifier",
      "rejected": [],
      "exactness": "exact",
      "requires": [
        "issues.read"
      ]
    },
    {
      "id": "implement-change",
      "method": "worker",
      "reason": "multi-step work with tools",
      "rejected": [
        {
          "method": "llm",
          "why": "needs to run tests, not only write text"
        }
      ],
      "exactness": "tolerant",
      "fallback": {
        "when": "tests fail twice",
        "to": "human"
      },
      "requires": [
        "code.edit",
        "code.test",
        "vcs.branch"
      ],
      "depends_on": [
        "read-issue"
      ]
    },
    {
      "id": "open-pull-request",
      "method": "rule",
      "reason": "a fixed API call",
      "rejected": [],
      "exactness": "exact",
      "requires": [
        "vcs.pullrequest"
      ],
      "depends_on": [
        "implement-change"
      ]
    }
  ],
  "results_in": "run",
  "status": "draft"
}
